"title","message","url","published_at","valid_from","valid_to","location_label","category"
"Obchodnú verejnú súťaž o najvhodnejší návrh na uzavretie dlhodobej nájomnej zmluvy k nehnuteľnosti v Bratislave, k.ú. Karlova Ves:","Mestsk&aacute; časť Bratislava &ndash; Karlova Ves N&aacute;mestie sv. Franti&scaron;ka 8, Bratislava, IČO: 603520 zast&uacute;pen&aacute; starostkou Ing. Ivetou Hanul&iacute;kovou v y h l a s u j e Obchodn&uacute; verejn&uacute; s&uacute;ťaž podľa &sect; 9a ods. 1 p&iacute;sm. a) a ods. 9/ z&aacute;kona Slovenskej n&aacute;rodnej rady č&iacute;slo 138/1991 Zb. o majetku obc&iacute; v znen&iacute; neskor&scaron;&iacute;ch predpisov a podľa z&aacute;kona Slovenskej n&aacute;rodnej rady č&iacute;slo 116/1990 Zb. o n&aacute;jme a podn&aacute;jme nebytov&yacute;ch priestorov v znen&iacute; neskor&scaron;&iacute;ch predpisov, o najvhodnej&scaron;&iacute; n&aacute;vrh na uzavretie dlhodobej n&aacute;jomnej zmluvy k nehnuteľnosti v Bratislave, k.&uacute;. Karlova Ves: PODMIENKY OBCHODNEJ VEREJNEJ S&Uacute;ŤAŽE 1. Identifik&aacute;cia vyhlasovateľa (prenaj&iacute;mateľa): N&aacute;zov: Mestsk&aacute; časť Bratislava &ndash; Karlova Ves S&iacute;dlo: N&aacute;mestie sv. Franti&scaron;ka 8, 842 62 Bratislava IČO: 603520 Bankov&eacute; spojenie: Dexia banka Slovensko a.s. Č&iacute;slo &uacute;čtu: 1804143001/5600 V zast&uacute;pen&iacute;: Ing. Iveta Hanul&iacute;kov&aacute; &ndash; starostka Kontaktn&aacute; osoba: Mgr. M&aacute;ria Kov&aacute;čov&aacute;, tel.č.: 02 / 60259221 E-mail: maria.kovacova@karlovaves.sk JUDr. Darina Gullar, tel.č.: 02 / 60259220 E-mail: darina.gullar@karlovaves.sk Vyhlasovateľ nie je platca DPH. Vyhlasovateľ je platca dane z pr&iacute;jmu. 2. &Scaron;pecifik&aacute;cia predmetu obchodnej verejnej s&uacute;ťaže: Predmetom dlhodob&eacute;ho n&aacute;jmu je stavebn&yacute; objekt s&uacute;pis.č. 5308 &ndash; t.č. nefunkčn&eacute; WC na Karloveskej ulici postavenom na pozemku parc.č. 1160/13 o zastavanej ploche 87 m2, ktor&yacute; je v katastri nehnuteľnost&iacute; k.&uacute;. Bratislava &ndash; Karlova Ves zap&iacute;san&yacute; na liste vlastn&iacute;ctva č&iacute;slo 27. Stručn&yacute; popis: Nebytov&yacute; priestor s&uacute;pis.č. 5308 postaven&yacute; na parcele č. 1160/13 je s&uacute;časťou nebytov&yacute;ch &ndash; predajn&yacute;ch priestorov nach&aacute;dzaj&uacute;cich sa v radovej z&aacute;stavbe na Karloveskej ulici za kostolom sv. Michala (pr&iacute;stup z Karloveskej ulice) situovan&yacute;ch na &uacute;rovni 1. NP - zo zadnej strany bytov&eacute;ho domu s pr&iacute;stupom od ulice Ladislava S&aacute;ru 2-8. P&ocirc;vodne v čase prev&aacute;dzky bl&iacute;zkeho trhoviska nebytov&yacute; priestor sl&uacute;žil ako verejn&eacute; WC s delen&iacute;m osobitne na mužsk&eacute; a žensk&eacute; WC - v s&uacute;časnosti nepouž&iacute;van&eacute;. Voľn&aacute; plocha b&yacute;val&eacute;ho trhoviska nach&aacute;dzaj&uacute;ca sa pred nebytov&yacute;mi priestormi sa v s&uacute;časnom obdob&iacute; vyž&iacute;va ako parkovisko. S&uacute;ťažn&yacute; n&aacute;vrh možno podať len na pren&aacute;jom stavebn&eacute;ho objektu ako celku. 3. Typ zmluvy: Dlhodob&aacute; n&aacute;jomn&aacute; zmluva podľa z&aacute;kona o n&aacute;jme a podn&aacute;jme nebytov&yacute;ch priestorov. 4. Lehota a sp&ocirc;sob predloženia n&aacute;vrhu: S&uacute;ťaž sa zač&iacute;na dňom jej uverejnenia na &uacute;radnej tabuli Mestskej časti Bratislava &ndash; Karlova Ves, N&aacute;mestie sv. Franti&scaron;ka 8, 842 62 Bratislava a na webovej str&aacute;nke Mestskej časti Bratislava &ndash; Karlova Ves www.karlovaves.sk. Navrhovateľ predklad&aacute; svoj n&aacute;vrh v zmysle nasledovn&yacute;ch in&scaron;trukci&iacute;: a) Deň, mesiac, rok a hodina, dokedy sa m&ocirc;žu predkladať n&aacute;vrhy: po uverejnen&iacute; s&uacute;ťaže na &uacute;radnej tabuli Mestskej časti Bratislava &ndash; Karlova Ves a na webovej str&aacute;nke mestskej časti do 21. novembra 2011 (pondelok) do 12.00 hod. &ndash; rozhoduj&uacute;ci je d&aacute;tum doručenia n&aacute;vrhu do podateľne Miestneho &uacute;radu Mestskej časti Bratislava &ndash; Karlova Ves. Dodržanie uveden&eacute;ho d&aacute;tumu sa dot&yacute;ka aj n&aacute;vrhov zaslan&yacute;ch po&scaron;tou. b) Adresa, na ktor&uacute; sa m&aacute; n&aacute;vrh doručiť: Miestny &uacute;rad Mestskej časti Bratislava &ndash; Karlova Ves, N&aacute;mestie sv. Franti&scaron;ka 8, 842 62 Bratislava. c) Jazyk, v ktorom sa mus&iacute; p&iacute;somn&yacute; n&aacute;vrh predložiť: slovensk&yacute;. d) Forma predloženia n&aacute;vrhu: V&scaron;etky požadovan&eacute; dokumenty, ktor&eacute; bud&uacute; s&uacute;časťou s&uacute;ťažn&eacute;ho n&aacute;vrhu je nutn&eacute; doručiť v p&iacute;somnej forme v uzavretom obale označenom odosielateľom, n&aacute;zvom a s&iacute;dlom navrhovateľa a heslom: Obchodn&aacute; verejn&aacute; s&uacute;ťaž &ndash; dlhodob&yacute; n&aacute;jom majetku &bdquo;Nefunkčn&eacute; WC na Karloveskej ulici &ndash; NEOTV&Aacute;RAŤ&ldquo;. e) Predložen&yacute; n&aacute;vrh mus&iacute; okrem in&eacute;ho obsahovať najm&auml;: &bull; Identifikačn&eacute; &uacute;daje vyhlasovateľa &ndash; viď. bod 1/ &bull; identifikačn&eacute; &uacute;daje navrhovateľa (&uacute;častn&iacute;ka s&uacute;ťaže): - pri fyzick&yacute;ch osob&aacute;ch: meno a priezvisko, rodn&eacute; priezvisko, d&aacute;tum narodenia, rodn&eacute; č&iacute;slo, adresa trval&eacute;ho bydliska, v deň pod&aacute;vania s&uacute;ťažn&eacute;ho n&aacute;vrhu mus&iacute; dovŕ&scaron;iť vek 18 rokov; - pri pr&aacute;vnick&yacute;ch osob&aacute;ch: obchodn&eacute; meno, s&iacute;dlo, IČO, DIČ, DIČ DPH, &scaron;tatut&aacute;rny org&aacute;n s uveden&iacute;m opr&aacute;vnenosti ku konaniu; so s&uacute;ťažn&yacute;m n&aacute;vrhom predložiť origin&aacute;l v&yacute;pisu z Obchodn&eacute;ho registra nie star&scaron;&iacute; ako jeden mesiac; - pri fyzick&yacute;ch osob&aacute;ch - podnikateľoch: meno a priezvisko, rodn&eacute; priezvisko, adresa miesta podnikania, č&iacute;slo živnostensk&eacute;ho opr&aacute;vnenia, IČO, so s&uacute;ťažn&yacute;m n&aacute;vrhom predložiť origin&aacute;l v&yacute;pisu živnostensk&eacute;ho opr&aacute;vnenia nie star&scaron;&iacute; ako jeden mesiac, &bull; označenie kontaktnej osoby navrhovateľa, telefonick&yacute; kontakt a e-mailov&uacute; adresu, &bull; predmet obchodnej verejnej s&uacute;ťaže, &bull; &uacute;čel využitia stavebn&eacute;ho objektu po jeho rekon&scaron;trukcii (nepr&iacute;pustn&aacute; prev&aacute;dzka, kde sa pod&aacute;vaj&uacute; alkoholick&eacute; n&aacute;poje resp. sa spr&iacute;stupňuj&uacute; erotick&eacute; materi&aacute;ly), &bull; v&yacute;&scaron;ku ročn&eacute;ho n&aacute;jomn&eacute;ho za cel&yacute; predmet n&aacute;jmu, na ktor&uacute; &uacute;častn&iacute;k zvy&scaron;uje zverejnen&uacute; minim&aacute;lnu sumu ročn&eacute;ho n&aacute;jomn&eacute;ho 2 000,- Eur, &bull; p&iacute;somn&eacute; čestn&eacute; prehl&aacute;senie navrhovateľa, že s&uacute;hlas&iacute; s podmienkami obchodnej verejnej s&uacute;ťaže uveden&yacute;mi v bode 7/ tohto vyhl&aacute;senia s&uacute;ťaže, &bull; p&iacute;somn&eacute; čestn&eacute; prehl&aacute;senie (&scaron;tatut&aacute;rneho z&aacute;stupcu v pr&iacute;pade pr&aacute;vnickej osoby) o tom, že &uacute;častn&iacute;k nem&aacute; a ani v minulosti nemal z&aacute;v&auml;zky voči hlavn&eacute;mu mestu SR Bratislave, voči Mestskej časti Bratislava &ndash; Karlova Ves, voči organiz&aacute;ci&aacute;m v ich zriaďovateľskej p&ocirc;sobnosti, resp. v ktorej maj&uacute; majetkov&uacute; &uacute;časť, ani voči pr&iacute;slu&scaron;n&eacute;mu daňov&eacute;mu &uacute;radu, &bull; vyhl&aacute;senie &uacute;častn&iacute;ka s&uacute;ťaže (len fyzick&aacute; osoba) o s&uacute;hlase so spracovan&iacute;m osobn&yacute;ch &uacute;dajov v zmysle z&aacute;kona č&iacute;slo 428/2002 Z.z. o ochrane osobn&yacute;ch &uacute;dajov, &bull; predložen&yacute; n&aacute;vrh nie je možn&eacute; meniť a dopĺňať, ani ho upravovať po uplynut&iacute; lehoty určenej na predkladanie s&uacute;ťažn&yacute;ch n&aacute;vrhov, s v&yacute;nimkou uvedenou v bode 7, p&iacute;sm. d/, &bull; každ&yacute; &uacute;častn&iacute;k s&uacute;ťaže m&ocirc;že podať iba jeden n&aacute;vrh na uzatvorenie zmluvy; n&aacute;vrh podan&yacute; nesk&ocirc;r t&yacute;m ist&yacute;m &uacute;častn&iacute;kom s&uacute;ťaže ru&scaron;&iacute; jeho predch&aacute;dzaj&uacute;ce podan&eacute; n&aacute;vrhy. S&uacute;ťažn&eacute; n&aacute;vrhy doručen&eacute; in&yacute;m sp&ocirc;sobom, v otvorenej ob&aacute;lke, bez uvedenia hesla, bez ob&aacute;lky, po stanovenom term&iacute;ne odovzdania, nebud&uacute; do obchodnej verejnej s&uacute;ťaže prijat&eacute;. 5. Rozsah a &uacute;plnosť s&uacute;ťažn&eacute;ho n&aacute;vrhu: N&aacute;vrh mus&iacute; byť predložen&yacute; v s&uacute;lade s podmienkami s&uacute;ťaže a v požadovanom rozsahu. 6. Doba n&aacute;jmu, rekon&scaron;trukcia a prev&aacute;dzka objektu: a) doba n&aacute;jmu: 20 rokov od nadobudnutia &uacute;činnosti n&aacute;jomnej zmluvy, b) v&iacute;ťaz obchodnej verejnej s&uacute;ťaže zn&aacute;&scaron;a v plnom rozsahu n&aacute;klady na rekon&scaron;trukciu objektu a n&aacute;sledn&eacute; opravy, &uacute;pravy, udržiavanie objektu vr&aacute;tane odstraňovania hav&aacute;ri&iacute; počas celej doby n&aacute;jmu bez n&aacute;roku na ich &uacute;hradu c) ročn&aacute; v&yacute;&scaron;ka n&aacute;jomn&eacute;ho, ktor&aacute; bude uveden&aacute; v n&aacute;jomnej zmluve sa zv&yacute;&scaron;i v pr&iacute;pade, ak sa zv&yacute;&scaron;i daň z pr&iacute;jmov, ktor&uacute; obec bude uhr&aacute;dzať počn&uacute;c rokom 2012 z pr&iacute;jmov z&iacute;skan&yacute;ch v roku 2011, ktor&aacute; je v s&uacute;časnom obdob&iacute; 19 % a v pr&iacute;pade infl&aacute;cie, d) n&aacute;klady na energie a odvoz odpadu bude v&iacute;ťaz obchodnej verejnej s&uacute;ťaže (n&aacute;jomca) uhr&aacute;dzať priamo dod&aacute;vateľom na z&aacute;klade s nimi uzatvoren&yacute;ch zml&uacute;v, e) v&iacute;ťaz obchodnej verejnej s&uacute;ťaže uzatvor&iacute; a po cel&uacute; dobu n&aacute;jmu bude udržiavať na vlastn&eacute; n&aacute;klady v platnosti poistn&eacute; zmluvy, ktor&eacute; bud&uacute; pokr&yacute;vať nasledovn&eacute; rizik&aacute;: - poistenie predmetu n&aacute;jmu proti živeln&yacute;m pohrom&aacute;m, - poistenie rizika kr&aacute;deže vl&aacute;man&iacute;m a vandalizmu v predmete n&aacute;jmu. 7. Ďal&scaron;ie podmienky vyhlasovateľa: a) vyhlasovateľ si vyhradzuje pr&aacute;vo zmeniť podmienky s&uacute;ťaže, odmietnuť v&scaron;etky predložen&eacute; n&aacute;vrhy alebo s&uacute;ťaž zru&scaron;iť podľa &sect; 283 z&aacute;kona č&iacute;slo 513/1991 Zb. Obchodn&eacute;ho z&aacute;konn&iacute;ka; o zru&scaron;en&iacute; s&uacute;ťaže bud&uacute; &uacute;častn&iacute;ci s&uacute;ťaže, ktor&iacute; podali n&aacute;vrhy, p&iacute;somne vyrozumen&iacute;. Zru&scaron;enie s&uacute;ťaže bude uverejnen&eacute; na &uacute;radnej tabuli Mestskej časti Bratislava &ndash; Karlova Ves na N&aacute;mest&iacute; sv. Franti&scaron;ka 8, Bratislava a na webovej str&aacute;nke mestskej časti www.karlovaves.sk, b) vyhlasovateľ si vyhradzuje pr&aacute;vo odmietnuť v&scaron;etky predložen&eacute; n&aacute;vrhy (&sect; 287 ods. 2 z&aacute;kona č&iacute;s. 513/1991 Zb. Obchodn&eacute;ho z&aacute;konn&iacute;ka) a ukončiť obchodn&uacute; verejn&uacute; s&uacute;ťaž bez v&yacute;beru s&uacute;ťažn&eacute;ho n&aacute;vrhu, c) n&aacute;vrh nemožno odvolať po jeho doručen&iacute; vyhlasovateľovi, d) vyhlasovateľ si vyhradzuje pr&aacute;vo predĺžiť lehotu na vyhl&aacute;senie vybran&eacute;ho s&uacute;ťažn&eacute;ho n&aacute;vrhu, e) vyhlasovateľ si vyhradzuje pr&aacute;vo v pr&iacute;pade zistenia ne&uacute;plnosti s&uacute;ťažn&eacute;ho n&aacute;vrhu z hľadiska požiadaviek vyhlasovateľa uveden&yacute;ch v s&uacute;ťažn&yacute;ch podkladoch (najm&auml; ak navrhnut&aacute; v&yacute;&scaron;ka ročn&eacute;ho n&aacute;jomn&eacute;ho bude niž&scaron;ia ako 2 000,&ndash; Eur), vyradiť n&aacute;vrh z obchodnej verejnej s&uacute;ťaže, f) vyhlasovateľ si vyhradzuje pr&aacute;vo v pr&iacute;pade form&aacute;lnych nedostatkov, ktor&eacute; nemenia obsah s&uacute;ťažn&eacute;ho n&aacute;vrhu, vyzvať uch&aacute;dzača na jeho doplnenie, g) v pr&iacute;pade, že s navrhovateľom v&iacute;ťazn&eacute;ho n&aacute;vrhu nebude uzatvoren&aacute; zmluva z d&ocirc;vodov na strane navrhovateľa (odst&uacute;pi od zmluvy, resp. v určenom term&iacute;ne nepodp&iacute;&scaron;e zmluvu), vyhlasovateľ m&ocirc;že uzavrieť zmluvu s navrhovateľom, ktor&yacute; sa vo vyhodnoten&iacute; obchodnej verejnej s&uacute;ťaže umiestnil ako ďal&scaron;&iacute; v porad&iacute;. h) n&aacute;jomn&uacute; zmluvu je navrhovateľ povinn&yacute; uzatvoriť do 30 dn&iacute; od schv&aacute;lenia predaja nehnuteľnost&iacute; v miestnom zastupiteľstve. 8. S&uacute;ťažn&eacute; podmienky: S&uacute;ťažn&eacute; podmienky je možn&eacute; z&iacute;skať na Miestnom &uacute;rade Bratislava &ndash; Karlova Ves, N&aacute;mestie sv. Franti&scaron;ka 8, Bratislava &ndash; 1.poschodie, č&iacute;s.dv. 221, 220 v pracovn&yacute;ch dňoch - v pondelok a v stredu od 8.00 hod. do 16.30 hod., v utorok a vo &scaron;tvrtok od 8.00 hod. do 14.30 hod. a v piatok od 8.00 hod. do 13.00 hod. alebo na webovej str&aacute;nke mestskej časti www.karlovaves.sk. 9. Povinnosť v&iacute;ťaza obchodnej verejnej s&uacute;ťaže spojen&aacute; s odpisom vody: V&iacute;ťaz obchodnej verejnej s&uacute;ťaže je povinn&yacute; vykon&aacute;vať odpis vody na hodin&aacute;ch spoločn&yacute;ch pre 5 vedľaj&scaron;&iacute;ch obchodn&yacute;ch prev&aacute;dzok (vr&aacute;tane objektu ktor&yacute; je predmetom tejto obchodnej verejnej s&uacute;ťaže), ktor&eacute; hodiny s&uacute; umiestnen&eacute; vo vodomernej &scaron;achte nach&aacute;dzaj&uacute;cej sa na chodn&iacute;ku pre chodcov (umiestnenie tohto merača vody bude ozrejmen&eacute; pri obhliadke predmetu n&aacute;jmu); n&aacute;klady na celkov&uacute; spotrebu vody prepoč&iacute;tavať podľa spotreby vykazovanej na pomern&yacute;ch meračoch vedľaj&scaron;&iacute;ch prev&aacute;dzok, inkasovať od nich finančn&eacute; čiastky zodpovedaj&uacute;ce ich spotrebe vody a Bratislavskej vod&aacute;renskej spoločnosti uhr&aacute;dzať n&aacute;klady za cel&yacute; odber vody na z&aacute;klade obdržanej fakt&uacute;ry. 10. Obhliadky nebytov&eacute;ho priestoru: Spoločn&eacute; obhliadky nebytov&eacute;ho priestoru sa uskutočnia v dňoch 12.10.2011 (v stredu) a 17.10.2011 (v pondelok) v čase od 16.00 hod. do 16.30 hod. 11. V&yacute;sledok obchodnej verejnej s&uacute;ťaže: V&yacute;sledok obchodnej verejnej s&uacute;ťaže bude jej &uacute;častn&iacute;kom ozn&aacute;men&yacute; p&iacute;somne do 15 kalend&aacute;rnych dn&iacute; odo dňa schv&aacute;lenia v&iacute;ťaza obchodnej verejnej s&uacute;ťaže v miestnom zastupiteľstve. V Bratislave, dňa 28.septembra 2011 Súbory: VOS_nebyt.priest.nefunk.WC-najom.sept_.2011.rtf wc.pdf","http://www.karlovaves.sk/dolezite-oznamy/obchodnu-verejnu-sutaz-o-najvhodnejsi-navrh-na-uzavretie-dlhodobej-najomnej-zmluvy-k","27.9.2011",,"21.11.2011","Karlova Ves","Správy"
"OZNÁMENIE zámeru ako prípadu hodného osobitného zreteľa ","MČ Bratislava - Karlova Ves oznamuje z&aacute;mer v s&uacute;lade s ustanoven&iacute;m &sect; 9a ods. 8 p&iacute;sm. e) z&aacute;kona SNR č. 138/1991 Zb. o majetku obc&iacute; z d&ocirc;vodu osobitn&eacute;ho zreteľa predať pozemok časť parcely č. 2260 na Solo&scaron;nickej ulici, ktor&yacute; tvor&iacute; p&aacute;s medzi obrubn&iacute;kom komunik&aacute;cie Solo&scaron;nick&aacute; ulica a oploten&iacute;m vybudovan&yacute;m pozdĺž pozemku parc. č. 2270, ktor&aacute; je vo vlastn&iacute;ctve žiadateľky a tiež priestor pred vstupnou br&aacute;nou nehnuteľnosti vo vlastn&iacute;ctve žiadateľky. Súbory: Oznamenie_zameru_Predaj_pozemku.PDF","http://www.karlovaves.sk/dolezite-oznamy/oznamenie-zameru-ako-pripadu-hodneho-osobitneho-zretela-0","25.9.2011",,,"Karlova Ves","Správy"
"OZNAM - predĺženie doby nájmu na nehnuteľnosti v k. ú. Karlova Ves z dôvodu hodného osobitného zreteľa","Oznamujeme, že Mestsk&aacute; časť Bratislava &ndash; Karlova Ves v s&uacute;lade s ustanoven&iacute;m &sect; 9a ods. 9 p&iacute;sm. c) z&aacute;kona SNR č. 138/1991 Zb. o majetku obci v znen&iacute; neskor&scaron;&iacute;ch predpisov z d&ocirc;vodu hodn&eacute;ho osobitn&eacute;ho zreteľa predĺži dobu n&aacute;jmu na nehnuteľnosti nach&aacute;dzaj&uacute;ce sa v k.&uacute;. Bratislava &ndash; Karlova Ves: a) stavebn&yacute; objekt - are&aacute;l z&aacute;kladn&yacute;ch &scaron;k&ocirc;l pri objekte č&iacute;s. 237 (Z&Scaron; Majern&iacute;kova č. 60, 62) v OS Dlh&eacute; diely, 2. stavba obsahuj&uacute;ci: zariadenie ihr&iacute;sk, oplotenie, sadov&eacute; &uacute;pravy, polievac&iacute; vodovod, pe&scaron;ie komunik&aacute;cie, oporn&eacute; m&uacute;ry a ter&eacute;nne &uacute;pravy, b) pozemky - parc.č.: 1669/2, 1669/584, 1669/585, 1669/586, 1669/587, 1669/588, 1669/589, 1669/590, 1669/591, 1669/592, 1669/593, 1669/596, 1669/599 o celkovej v&yacute;mere 21 018 m2 n&aacute;jomcovi Karlovesk&eacute;mu &scaron;portov&eacute;mu klubu, Janotova 12, Bratislava na dobu od 6.10.2011 do 5.10.2021. Podľa čl. V. n&aacute;jomnej zmluvy č&iacute;slo 061 0 21 60 99 uzavretej dňa 5.10.1999 n&aacute;jomn&eacute; za dočasn&eacute; už&iacute;vanie vy&scaron;&scaron;ie uveden&yacute;ch nehnuteľnost&iacute; je určen&eacute; dohodou zmluvn&yacute;ch str&aacute;n a to vecn&yacute;m plnen&iacute;m, t. j. n&aacute;jomca zabezpeč&iacute; počas n&aacute;jmu na vlastn&eacute; n&aacute;klady vecn&uacute; &uacute;držbu cel&eacute;ho &scaron;portov&eacute;ho are&aacute;lu (&uacute;držba a vyznačenie ihr&iacute;sk, udržiavanie čistoty, odvoz odpadu, polievanie tr&aacute;vnika a jeho &uacute;držba, v&yacute;mena a &uacute;držba antuky, &uacute;držba &scaron;portov&eacute;ho n&aacute;radia, oprava plotu a pod.). Súbory: Oznam_Najom_KSK.PDF","http://www.karlovaves.sk/dolezite-oznamy/oznam-predlzenie-doby-najmu-na-nehnutelnosti-v-k-u-karlova-ves-z-dovodu-hodneho-osob","13.9.2011","6.10.201","5.10.2021","Karlova Ves","Správy"
"Verejné obstarávanie - obnova náteru priechodov pre chodcov","Verejn&eacute; obstar&aacute;vanie pre z&aacute;kazku s n&iacute;zkou hodnotou Mestsk&aacute; časť Bratislava &ndash; Karlova Ves, N&aacute;m. Sv. Franti&scaron;ka 8, 842 62 Bratislava vyhlasuje verejn&eacute; obstar&aacute;vanie pre z&aacute;kazku s n&iacute;zkou hodnotou podľa &sect; 102, ods. 1, z&aacute;kona č. 25/2006 Z.z. na v&yacute;ber dod&aacute;vateľa na realiz&aacute;ciu vodorovn&eacute;ho dopravn&eacute;ho značenia, Časť I. V&scaron;eobecn&eacute; inform&aacute;cie 1. Identifik&aacute;cia vyhlasovateľa N&aacute;zov a s&iacute;dlo organiz&aacute;cie: Mestsk&aacute; časť Bratislava &ndash; Karlova Ves, N&aacute;m. sv. Franti&scaron;ka č. 8 , 842 62 Bratislava Kontaktn&aacute; osoba: Ing. Martin Patoprst&yacute;, Juraj Toman, telef&oacute;n: 02/60259218, e-mail: martin.patoprsty@karlovaves.sk, juraj.toman@karlovaves.sk 2. Predmet obstar&aacute;vania a doba realiz&aacute;cie Predmetom obstar&aacute;vania je obnova n&aacute;teru priechodov pre chodcov podľa priložen&eacute;ho zoznamu priechodov a realiz&aacute;cia nov&yacute;ch priechodov pre chodcov a vodorovn&eacute;ho dopravn&eacute;ho značenia V13 v MČ Karlova Ves podľa priložen&yacute;ch POD. Doba realiz&aacute;cie je do 15. septembra 2011, resp. podľa klimatick&yacute;ch podmienok. Časť II. Ohliadka predmetu obstar&aacute;vania a predkladanie pon&uacute;k 3. Ohliadka predmetu obstar&aacute;vania Obhliadku je možn&eacute; uskutočniť po dohode vyhlasovateľa s predkladateľmi. 4. Obsah ponuky Obchodn&eacute; meno a s&iacute;dlo pr&aacute;vnickej osoby alebo meno, priezvisko a trval&eacute; bydlisko fyzickej osoby, telefonick&eacute; a e-mailov&eacute; spojenie. V&yacute;&scaron;ka pon&uacute;knutej ceny za služby v EURO, vr&aacute;tane DPH. Podpis &scaron;tatut&aacute;rneho z&aacute;stupcu pr&aacute;vnickej osoby alebo podpis fyzickej osoby. 5. Miesto a lehota na predkladanie pon&uacute;k Ponuky je potrebn&eacute; doručiť na adresu vyhlasovateľa: Mestsk&aacute; časť Bratislava &ndash; Karlova Ves, N&aacute;m. sv. Franti&scaron;ka č. 8 , 842 62 Bratislava alebo elektronicky na martin.patoprsty@karlovaves.sk, juraj.toman@karlovaves.sk. Lehota na predkladanie pon&uacute;k uplynie dňa 12. augusta 2011 (piatok) do 13,30 hod. 6. Vyhodnotenie pon&uacute;k Jedin&eacute; krit&eacute;rium na hodnotenie pon&uacute;k je najniž&scaron;ia cena. V pr&iacute;pade rovnosti cien si vyhlasovateľ vyhradzuje pr&aacute;vo požiadať predkladateľov o upravenie cenovej ponuky. Vyhlasovateľ si vyhradzuje pr&aacute;vo verejn&eacute; obstar&aacute;vanie kedykoľvek zru&scaron;iť. Vyhlasovateľ si vyhradzuje pr&aacute;vo nevybrať ani jednu ponuku od uch&aacute;dzačov. 7. Uzatvorenie objedn&aacute;vky S v&iacute;ťazom s&uacute;ťaže bude podp&iacute;san&aacute; objedn&aacute;vka za &uacute;čelom realiz&aacute;cie vodorovn&eacute;ho dopravn&eacute;ho značenia na &uacute;zem&iacute; MČ Bratislava - Karlova Ves. S minim&aacute;lnymi podmienkami, ktor&eacute; musia byť s&uacute;časťou objedn&aacute;vky, sa uch&aacute;dzači m&ocirc;žu zozn&aacute;miť u kontaktnej osoby vyhlasovateľa. Ak ned&ocirc;jde k dohode o uzatvoren&iacute; objedn&aacute;vky s &uacute;spe&scaron;n&yacute;m predkladateľom, vyhlasovateľ bude o uzatvoren&iacute; objedn&aacute;vky rokovať s ďal&scaron;&iacute;mi predkladateľmi v porad&iacute;, ako sa umiestnili v s&uacute;ťaži. 8. Ďal&scaron;ie inform&aacute;cie Predpokladan&eacute; term&iacute;ny: vyhodnotenie pon&uacute;k do 12.08.2011, uzatvorenie objedn&aacute;vky do 19.08.2011. V Bratislave, dňa 09. augusta 2011. Pr&iacute;lohy: zoznam obnovovan&yacute;ch priechodov pre chodcov v MČ Karlova Ves nov&eacute; priechody pre chodcov Ad&aacute;miho (1x) a Pribi&scaron;ova (2x) &ndash; POD domaľovanie priechodu pre chodcov a doplnenie segmentov retard&eacute;ra na Veternicovej ulici a odstr&aacute;nenie vodorovn&eacute;ho značenia V10d (Parkovacie miesto s vyhraden&yacute;m st&aacute;t&iacute;m) zasahuj&uacute;ceho do priechodu pre chodcov &ndash; POD vodorovn&eacute; dopravn&eacute; značenie V13 pri bytovom dome P&uacute;pavova 4-6 a P&uacute;pavova 10 - POD vodorovn&eacute; dopravn&eacute; značenie V12b &bdquo;Žlt&aacute; s&uacute;visl&aacute; čiara&ldquo; pred bytov&yacute;m domom Lev&aacute;rsjka 9 - POD Ing. Iveta Hanul&iacute;kov&aacute; starostka Súbory: Zoznam_priechodov.xls POD_Adamiho.pdf POD_Levarska.pdf POD_Pribisova.pdf POD_Pupavova.pdf POD_Veternicova.pdf","http://www.karlovaves.sk/dolezite-oznamy/verejne-obstaravanie-obnova-nateru-priechodov-pre-chodcov","8.8.2011",,"12.8.2011","Karlova Ves","Správy"
"OZNÁMENIE zámeru ako prípadu hodného osobitného zreteľa","Mestsk&aacute; časť Bratislava - Karlova Ves oznamuje svoj z&aacute;mer A/ na uzatvorenie novej n&aacute;jomnej zmluvy na pozemky parc. č. 3269/3 - z&aacute;hradu a parc. č. 3269/4 zastavan&uacute; z&aacute;hradnou chatou v lokalite nad Dev&iacute;nskou cestou v Bratislave. Nov&uacute; n&aacute;jomn&uacute; zmluvu navrhujeme schv&aacute;liť v s&uacute;lade s ustanoven&iacute;m &sect; 9a ods. 9 p&iacute;sm. c) z&aacute;kona SNR č. 138/1991 Zb. o majetku obc&iacute; ako pr&iacute;pad hodn&yacute; osobitn&eacute;ho zreteľa vzhľadom k tomu, že na parc. č. 3269/4 je postaven&aacute; z&aacute;hradn&aacute; chata zap&iacute;san&aacute; v katastri nehnuteľnost&iacute; na liste vlastn&iacute;ctva, ktor&uacute; odk&uacute;pil od predch&aacute;dzaj&uacute;ceho n&aacute;jomcu pozemku a vlastn&iacute;ka chaty. B/ predĺženie doby n&aacute;jmu na pozemky pod gar&aacute;žami dodatkami na uveden&eacute; obdobie z d&ocirc;vodu uplynutia lehoty platnosti n&aacute;jomn&yacute;ch zml&uacute;v. Dodatky k n&aacute;jomn&yacute;m zmluv&aacute;m navrhujeme schv&aacute;liť v s&uacute;lade s ustanoven&iacute;m &sect; 9a ods. 9 p&iacute;sm. c) z&aacute;kona SNR č. 138/1991 Zb. o majetku obc&iacute; ako pr&iacute;pad hodn&yacute; osobitn&eacute;ho zreteľa vzhľadom k tomu, že gar&aacute;že s&uacute; v osobnom vlastn&iacute;ctve n&aacute;jomcov a pozemky nemožno predať inej fyzickej alebo pr&aacute;vnickej osobe. Súbory: Oznamenie_zameru.PDF","http://www.karlovaves.sk/dolezite-oznamy/oznamenie-zameru-ako-pripadu-hodneho-osobitneho-zretela","7.8.2011",,,"Karlova Ves","Správy"
