"title","message","url","published_at","valid_from","valid_to","location_label","category"
"Kresťanskí seniori boli v Šaštíne a Radošinej ","Medzi akt&iacute;vne karlovesk&eacute; spoločenstv&aacute; patr&iacute; aj miestny klub Združenia kresťansk&yacute;ch seniorov. Sch&aacute;dzaj&uacute; sa pravidelne každ&yacute; mesiac v Pastoračnom centre sv. Franti&scaron;ka a okrem prejedn&aacute;vania svojich vn&uacute;torn&yacute;ch z&aacute;ležitost&iacute; si poz&yacute;vaj&uacute; i v&yacute;znamn&yacute;ch odborn&iacute;kov s aktu&aacute;lnymi predn&aacute;&scaron;kami. Medzi nimi boli napr. prim&aacute;r geriatrick&eacute;ho oddelenia v Pod. Biskupiciach MUDr. Rippel, ktor&yacute; hovoril o zdravotn&yacute;ch probl&eacute;moch seniorov, MUDr. J&aacute;n Janok hovoril o svojom str&yacute;kovi, redemptoristovi RNDr. J&aacute;novi Janokovi, Jozef Milo&scaron;ko o Svetovom f&oacute;re Fatima, Dr. Plach&aacute; o hist&oacute;rii Dev&iacute;na, Dr. Karol Kasala, PhD o demografickom v&yacute;voji, Ing. Rado&scaron;insk&yacute; o T&iacute;tovi Zemanovi, SBD. V utorok 20.sept.2011 sa r&aacute;no stretli členovia Združenia kresťansk&yacute;ch seniorov z Karlovej Vsi i D&uacute;bravky na bratislavskej hlavnej železničnej stanici a spolu cestovali do &Scaron;a&scaron;t&iacute;na, kde sa konala celoslovensk&aacute; p&uacute;ť seniorov, ktor&aacute; sa každoročne uskutočňuje v n&aacute;v&auml;znosti na veľk&uacute; p&uacute;ť k patr&oacute;nke Slovenska Sedembolestnej Pani M&aacute;rii na jej sviatok 15. septembra. Sl&aacute;vnostn&uacute; sv&auml;t&uacute; om&scaron;u v bazilike Sedembolestnej Panny M&aacute;rie celebroval Trnavsk&yacute; pomocn&yacute; biskup a gener&aacute;lny vik&aacute;r Mons. J&aacute;n Orosch. S&uacute;časťou programu bol aj pr&iacute;hovor predsedu ZKS Jozefa Miklo&scaron;ku a duchovno kult&uacute;rny program Združenia kresťansk&yacute;ch seniorov Slovenska. Popoludn&iacute; bola kr&iacute;žov&aacute; cesta seniorov s požehnan&iacute;m p&aacute;na far&aacute;ra J.Zachara. V piatok r&aacute;no dňa 23.9.2011 sa seniori op&auml;ť stretli, tentoraz pred Cirkevnou &scaron;kolou sv. Franti&scaron;ka, kam pre nich pri&scaron;iel autobus. Prvou zast&aacute;vkou seniorov na ich z&aacute;jazde bola Rado&scaron;in&aacute;, zn&aacute;ma svojim Rado&scaron;insk&yacute;m naivn&yacute;m divadlom, ktor&eacute; začalo p&ocirc;sobiť v r. 1963. Prv&aacute; spr&aacute;va o existencii kostola v Rado&scaron;ine je z roku 1332. Bol zasv&auml;ten&yacute; sv. Pavlovi. Nov&yacute; kostol bol postaven&yacute; v rokoch 1636 &ndash; 1644 a mal patroc&iacute;nium Najsv&auml;tej&scaron;ej trojice. Veža bola postaven&aacute; v r. 1663. Na p&ocirc;vodne renesančnom kostole boli v roku 1755 barokov&eacute; &uacute;pravy. Hlavn&yacute; olt&aacute;r s obrazom Najsv&auml;tej&scaron;ej Trojice poch&aacute;dza zo začiatku 18. storočia. Bočn&eacute; olt&aacute;re Sv&auml;t&eacute;ho kr&iacute;ža a Panny M&aacute;rie poch&aacute;dzaj&uacute; z l. polovice 18. storočia. Mramorov&aacute; krstiteľnica m&aacute; tvar kalicha a poch&aacute;dza zo začiatku 19. storočia. Bezprostredn&yacute;m d&ocirc;vodom n&aacute;v&scaron;tevy tohto kostola bola povestn&aacute;, každoročn&aacute; , kr&aacute;sna v&yacute;zdoba kostola z plodov tohoročnej &uacute;rody. M&ocirc;žete tam n&aacute;jsť pekne naaranžovan&eacute; v&scaron;etko od drobn&yacute;ch zrniečok maku až po obrovsk&eacute; tekvice. Najv&auml;č&scaron;iu pozornosť up&uacute;taj&uacute; obrazy vytvoren&eacute; z drobn&yacute;ch zrniečok r&ocirc;znych plod&iacute;n, vytvoren&eacute; &scaron;ikovn&yacute;mi rukami, veľkou trpezlivosťou a umeleck&yacute;m vn&iacute;man&iacute;m a stv&aacute;rnen&iacute;m rado&scaron;insk&yacute;ch žien. V&yacute;stavka spolu s odborn&yacute;m koment&aacute;rom, bola skutočn&yacute;m umeleck&yacute;m z&aacute;žitkom a hlbok&yacute;m obdivom vytvoren&eacute;ho diela. Ťažko by bolo možn&eacute; op&iacute;sať v&scaron;etku t&uacute; kr&aacute;su a d&ocirc;myselnosť tvorcov, to treba jednoducho vidieť a preto v&aacute;m n&aacute;v&scaron;tevu Rado&scaron;inej &uacute;primne odpor&uacute;čame. Vz&aacute;cnou kult&uacute;rnou pamiatkou Rado&scaron;inej je ka&scaron;tieľ z druhej polovice 16. storočia. P&ocirc;vodne bol renesančn&yacute;, ale v prvej tretine 17. storočia bol prestavan&yacute;. Už od počiatku ka&scaron;tieľ sl&uacute;žil na reprezentačn&eacute; &uacute;čely nitrianskeho biskupstva a je pop&iacute;san&yacute; v knihe polyhistora Mateja Bela (1684 &ndash; 1749). V ka&scaron;tieli sa zdržiaval r&aacute;d aj ostrihomsk&yacute; arcibiskup Peter P&aacute;zm&aacute;ny. Star&scaron;&iacute; z dvoch parkov, ktor&eacute; s&uacute; okolo ka&scaron;tieľa, bol v roku 1795 renovovan&yacute;. Povestn&yacute; je aj ga&scaron;tanov&yacute; sad. V roku 1993 dostal ka&scaron;tieľ nov&yacute;ch obyvateľov a stal sa s&iacute;dlom Komunity Kr&aacute;ľovnej pokoja. Z Rado&scaron;inej sme i&scaron;li do Čertovej peci. Prech&aacute;dzali sme okolo hospod&aacute;rstva, kde bol zauj&iacute;mav&yacute; pohľad na čierne a r&ocirc;zne pruhovan&eacute; prasiatka. Pr&iacute;rodn&aacute; pamiatka Jaskyňa Čertova pec je jaskynn&eacute; s&iacute;dlisko lovcov v star&scaron;ej dobe kamennej. Z tejto jaskyne poch&aacute;dzaj&uacute; početn&eacute; paleontologick&eacute;, antropologick&eacute; a archeologick&eacute; n&aacute;lezy z paleolitu, neolitu, z doby hal&scaron;tatskej a zo stredoveku. V sedimentoch sa na&scaron;li zvy&scaron;ky jaskynn&eacute;ho medveďa, jaskynnej hyeny a ďal&scaron;&iacute;ch 37 druhov zvierat. Ďal&scaron;ou zast&aacute;vkou bola obec Ducov&eacute;, odkiaľ sme i&scaron;li poľnou cestou na Kostolec. Najstar&scaron;ie os&iacute;dlenie poch&aacute;dza z paleolitu a patr&iacute; do obdobia gravettienskej kult&uacute;ry (26000 &ndash; 14000 rokov pred n.l.) Kostolec je n&aacute;rodn&aacute; kult&uacute;rna pamiatka a patr&iacute; medzi v&yacute;znamn&eacute; slovansk&eacute; lokality. V mlad&scaron;ej dobe bronzovej (1300 &ndash; 1100 rokov pred n.l. ) tu bolo v&yacute;znamn&eacute; hradisko a os&iacute;dlen&yacute; bol aj v dobe r&iacute;mskej ( 2. &ndash; 3 st. n. l.) Najv&yacute;znamnej&scaron;&iacute;m z hľadiska na&scaron;ich dej&iacute;n je obdobie Veľkej Moravy v 9. &ndash; 10. storoč&iacute; , kedy tam bolo vybudovan&eacute; veľmožsk&eacute; s&iacute;dlo. S&uacute;časťou dvorca bola palis&aacute;da z dubov&yacute;ch kolov, kostol&iacute;k (rotunda) a mal&eacute; pohrebisko. Vo v&yacute;chodnej časti veľmožsk&eacute;ho dvorca boli objaven&eacute; zvy&scaron;ky troch stavieb. V južnej časti boli objaven&eacute; z&aacute;klady kostola &ndash; rotundy s kruhovou loďou a podkovovitou apsidou. V hroboch boli n&aacute;jden&eacute; zlat&eacute;, strieborn&eacute; pozl&aacute;ten&eacute; a strieborn&eacute; n&aacute;u&scaron;nice, strieborn&eacute; gomb&iacute;ky, časti v&yacute;zbroje a jazdeckej v&yacute;stroje. Jednoznačne možno povedať, že Kostolec patr&iacute; medzi najv&yacute;znamnej&scaron;ie pamiatky veľkomoravskej kult&uacute;ry. Počasie bolo pekn&eacute; a bol odtiaľ kr&aacute;sny v&yacute;hľad na okolie ako aj na hrad Temat&iacute;n a Čachtick&yacute; hrad. Chybou je, že sa tejto v&yacute;znamnej pamiatke nevenuje v&auml;č&scaron;ia pozornosť. Na&scaron;a ďal&scaron;ia cesta viedla do Moravian, kde je renesančn&yacute; ka&scaron;tieľ zo 16. storočia, ktor&yacute; patr&iacute; k stavebn&yacute;m klenotom &scaron;ľachtickej architekt&uacute;ry. Paleontologick&eacute; a archeologick&eacute; n&aacute;lezy svedčia o tom, že tu bolo s&iacute;dlo lovcov mamutov. Obec je dobre zn&aacute;ma bohat&yacute;mi n&aacute;lezmi kamenn&yacute;ch n&aacute;strojov, zbran&iacute; a &scaron;perkov. V r. 1938 sa tu na&scaron;la Moravianska Venu&scaron;a &ndash; so&scaron;ka ženy vyrez&aacute;van&aacute; z mamutieho kla, ktorej vek sa odhaduje na 22 800 rokov. Origin&aacute;l so&scaron;ky je na Bratislavskom hrade. T&aacute;to časť n&aacute;&scaron;ho z&aacute;jazdu bola ne&uacute;spe&scaron;n&aacute;, pretože br&aacute;na do are&aacute;lu ka&scaron;tieľa bola zamknut&aacute; a za ňou veľk&eacute; psisko. Pr&iacute;činou je to, že ka&scaron;tieľ je v s&uacute;časnosti vo vlastn&iacute;ctve zahraničn&yacute;ch fyzick&yacute;ch os&ocirc;b, ktor&eacute; nekomunikuj&uacute; s org&aacute;nmi pamiatkov&eacute;ho fondu ani s obcou. Nie je zabezpečen&aacute; ochrana a objekt ch&aacute;tra! Operat&iacute;vnou zmenou programu bola n&aacute;v&scaron;teva Pie&scaron;ťan a tak sme posledn&eacute; pekn&eacute; chv&iacute;le prež&iacute;vali na k&uacute;peľnom ostrove, kochaj&uacute;c sa kr&aacute;sou rozkvitnut&yacute;ch r&ocirc;znofarebn&yacute;ch lekien a peknou parkovou &uacute;pravou, či pohľadom z Kolon&aacute;dov&eacute;ho mosta alebo chutnou zmrzlinou a n&aacute;kupom K&uacute;peľn&yacute;ch obl&aacute;tok. V presne stanoven&yacute; čas sme Pie&scaron;ťany opustili a &scaron;ťastlivo sa vr&aacute;tili do Karlovej Vsi. Vojto T&oacute;th Fotogal&eacute;ria tu ","http://www.karlovaves.sk/novinka/krestanski-seniori-boli-v-sastine-radosinej","29.9.2011",,,"Karlova Ves","Správy"
"OZNAM Hľadáme vedúcich záujmových krúžkov","Hľad&aacute;me &scaron;ikovn&yacute;ch ved&uacute;cich z&aacute;ujmov&yacute;ch kr&uacute;žkov r&ocirc;zneho zamerania, napr. model&aacute;rsky, fotografick&yacute;, v&yacute;tvarn&yacute; ... od septembra 2011 v KCK &ndash; Kult&uacute;rnom centre Karlovky na Molecovej 2. Z&aacute;ujemcovia sa m&ocirc;žu hl&aacute;siť na t.č. 0903 780 032.","http://www.karlovaves.sk/novinka/oznam-hladame-veducich-zaujmovych-kruzkov","10.8.2011",,,"Karlova Ves","Správy"
"Bratislavská mestská karta","Informačn&aacute; kampaň v s&uacute;vislosti so zv&yacute;&scaron;en&iacute;m tarifn&yacute;ch sadzieb mestskej hromadnej dopravy. Dňom 1. augusta 2011 do&scaron;lo k zv&yacute;&scaron;eniu tarifn&yacute;ch sadzieb v mestskej hromadnej doprave. Pre obyvateľov s trval&yacute;m pobytom v Bratislave je toto zv&yacute;&scaron;enie čiastočne kompenzovan&eacute; poskytovan&iacute;m bonusov (zliav) na Bratislavsk&uacute; mestsk&uacute; kartu. Hlavn&eacute; mesto SR Bratislava v tejto s&uacute;vislosti požiadalo MČ Bratislava - Karlova Ves o sprostredkovanie inform&aacute;ci&iacute; obyvateľom mestskej časti. Informačn&yacute; materi&aacute;l o Bratislavskej mestskej karte je zverejnen&yacute; v pr&iacute;lohe. V&scaron;etky inform&aacute;cie o Bratislavskej mestskej karte n&aacute;jdete aj na webovej str&aacute;nke www.karta.bratislava.sk. Prílohy: Bratislavska_mestska_karta.pdf","http://www.karlovaves.sk/novinka/bratislavska-mestska-karta","9.8.2011","1.8.2011",,"Karlova Ves","Správy"
"Tesco otvorilo nový expres v Karlovej Vsi","Vo &scaron;tvrtok 11. augusta 2011 o 8.00 hodine r&aacute;no otvorilo Tesco už 102. obchod na Slovensku. Je n&iacute;m najmen&scaron;&iacute; form&aacute;t Expres na Kempelenovej ulici v bratislavskej mestskej časti Karlova Ves. Tento 14. obchod mal&eacute;ho form&aacute;tu je situovan&yacute; v dvojpodlažnom n&aacute;kupnom centre. Expres je otvoren&yacute; sedem dn&iacute; v t&yacute;ždni od 6-tej do 22-ej hodiny večer. Pr&aacute;cu v novom obchode na&scaron;lo 22 zamestnancov. Na ploche 300 m2 z&aacute;kazn&iacute;ci dostan&uacute; v&scaron;etko, čo potrebuj&uacute; na r&yacute;chly každodenn&yacute; n&aacute;kup. Sp&ocirc;sob usporiadania reg&aacute;lov i sklen&yacute;ch chladiacich vitr&iacute;n až do v&yacute;&scaron;ky 1,8 metra tu poskytuje z&aacute;kazn&iacute;kom veľmi &scaron;irok&uacute; sortimentn&uacute; skladbu 2300 produktov. &bdquo;O predajňu bol už pred otvoren&iacute;m veľk&yacute; z&aacute;ujem a cel&yacute; t&iacute;m sa te&scaron;&iacute; na z&aacute;kazn&iacute;kov, ktor&yacute;m chceme poskytovať služby v najvy&scaron;&scaron;ej kvalite a z&iacute;skať si tak ich dlhodob&uacute; priazeň a stať sa ich najobľ&uacute;benej&scaron;ou predajňou v tejto lokalite. Z&aacute;kazn&iacute;ci sa m&ocirc;žu te&scaron;iť na naj&scaron;ir&scaron;&iacute; sortiment pek&aacute;rensk&yacute;ch v&yacute;robkov zo v&scaron;etk&yacute;ch expresov&ldquo;, hovor&iacute; manaž&eacute;r obchodu Milan Brinko&scaron;. Tesco sa tu bude prezentovať predov&scaron;etk&yacute;m čerstv&yacute;mi potravinami &ndash; ovoc&iacute;m a zeleninou, kvetmi. Na ploche tiež n&aacute;jdu denn&uacute; tlač, mliečne v&yacute;robky a lah&ocirc;dky a tiež pult s čerstv&yacute;m m&auml;som, &uacute;deninami a syrmi, ktor&eacute; poskytne osvedčen&yacute; n&aacute;jomca Nov&aacute;k. V z&oacute;ne chleba a pečiva čak&aacute; na z&aacute;kazn&iacute;kov &scaron;irok&yacute; v&yacute;ber čerstv&yacute;ch produktov vr&aacute;tane ponuky od lok&aacute;lnych pek&aacute;rov: RUDLA, spol. s .r.o., Talianska pek&aacute;reň Bageta, s.r.o. a RIVER spol. s r.o., za ktor&yacute;mi bud&uacute; nasledovať boxy s mrazen&yacute;mi v&yacute;robkami. N&aacute;poje, trvanliv&eacute; potraviny, hotov&eacute; jedl&aacute;, kozmetika, drog&eacute;ria, bagety tvoria centr&aacute;lnu časť tejto predajne. K&uacute;sok pred vchodom do predajne je n&aacute;v&scaron;tevn&iacute;kom expresu k dispoz&iacute;cii bankomat. Tesco si bude aj v tejto mestskej časti v&scaron;&iacute;mať potreby miestnych komun&iacute;t. Ako je dlhodob&yacute;m zvykom, pri pr&iacute;ležitosti otvorenia nov&eacute;ho obchodu vybran&aacute; neziskov&aacute; organiz&aacute;cia &ndash; Rodičovsk&eacute; združenie sv. Franti&scaron;ka &ndash; dostala symbolick&yacute; &scaron;ek. Združenie využije finančn&yacute; dar na zak&uacute;penie mikroskopov do pr&iacute;rodovednej učebne pre Spojen&uacute; &scaron;kolu sv. Franti&scaron;ka z Assisi na Karloveskej ulici 32. Okrem toho sa odovzdal aj ďal&scaron;&iacute; dar &ndash; reflexn&eacute; vesty pre bezpečnosť det&iacute; na cest&aacute;ch &ndash; 100 kusov dostala &Scaron;peci&aacute;lna matersk&aacute; &scaron;kola na Svrčej ulici 6 v Karlovej Vsi. Tesco Expres Kempelenova Bratislava &ndash; z&aacute;kladn&eacute; fakty: &bull; 14. obchod mal&eacute;ho form&aacute;tu a celkovo 102. obchod na Slovensku &bull; Otvorenie dňa 11. augusta 2011 o 8.00 hodine &bull; Predajn&aacute; plocha - 300 m2 &bull; R&yacute;chly servis na každodenn&yacute; n&aacute;kup &bull; Čerstv&eacute; aj trvanliv&eacute; potraviny &bull; Bankomat priamo pri predajni &bull; 2300 druhov v&yacute;robkov v ponuke &bull; 4 pokladne, z toho 2 expresn&eacute; &bull; otv&aacute;racia doba - 6.00 až 22.00 hod. sedem dn&iacute; v t&yacute;ždni &bull; 22 nov&yacute;ch pracovn&yacute;ch miest Spoločnosť Tesco Stores SR, a.s., člen Zv&auml;zu obchodu a cestovn&eacute;ho ruchu SR, vst&uacute;pila na slovensk&yacute; trh v roku 1996 a v s&uacute;časnosti prev&aacute;dzkuje 102 obchodov, z toho 5 obchodn&yacute;ch domov, 14 expresov, 54 hypermarketov, z toho 4 Extra, 29 supermarketov a 16 čerpac&iacute;ch stan&iacute;c. Prev&aacute;dzkuje tiež dve distribučn&eacute; centr&aacute; na potraviny v Beckove a v Pre&scaron;ove a &scaron;tyri obchodn&eacute; centr&aacute; Gal&eacute;ria v Bratislave-Lamači, Trnave, Nitre a Dunajskej Strede, v ktor&yacute;ch je vy&scaron;e 150 obchodov so zameran&iacute;m najm&auml; na m&oacute;du, obuv, doplnky, ako aj &scaron;irok&eacute; spektrum služieb vr&aacute;tane občerstvenia a možnost&iacute; z&aacute;bavy najm&auml; pre deti. So svojimi vy&scaron;e 8 800 zamestnancami patr&iacute; spoločnosť Tesco k najv&auml;č&scaron;&iacute;m s&uacute;kromn&yacute;m zamestn&aacute;vateľom na Slovensku. Z&aacute;kladom filozofie spoločnosti Tesco je poskytn&uacute;ť z&aacute;kazn&iacute;kovi najvy&scaron;&scaron;iu kvalitu za najlep&scaron;iu cenu a stať sa obchodom pre v&scaron;etk&yacute;ch. V pr&iacute;pade ak&yacute;chkoľvek ot&aacute;zok pros&iacute;m kontaktujte komunikačn&eacute; oddelenie: Tesco Stores SR, a.s. Cesta na Senec 2 821 04 Bratislava. Peter Sklen&aacute;ř Property Communications Manager Head Office / Corporate Affairs email: psklena1@sk.tesco-europe.com Tel.: +421 2 4949 6578 Mobile: +421 911 876 688","http://www.karlovaves.sk/novinka/tesco-otvorilo-novy-expres-v-karlovej-vsi","9.8.2011","11.8.2011",,"Karlova Ves","Správy"
"Predstavenie šaša Maroša roztancovalo všetky deti na námestí","&Scaron;a&scaron;o Maro&scaron;, jeden z najzn&aacute;mej&scaron;&iacute;ch &scaron;a&scaron;ov na Slovensku, vyst&uacute;pil pre karlovesk&eacute; deti so svojou show na N&aacute;m. sv. Franti&scaron;ka 3. augusta a rozosmial deti aj dospel&yacute;ch. Hneď na začiatku vyčaroval svoj obľ&uacute;ben&yacute; hudobn&yacute; n&aacute;stroj, gitaru, a z&aacute;bava sa začala. Deti si spolu s n&iacute;m zaspievali svoje obľ&uacute;ben&eacute; pesničky, nech&yacute;bala ani už klasika &bdquo;Darinka mandar&iacute;nka&ldquo;. Deti sa vy&scaron;antili v programe, v ktorom boli r&ocirc;zne hry, s&uacute;ťaže a kv&iacute;zy. Naučili sa od &scaron;a&scaron;a nov&yacute; tanec na pesničku &bdquo;Tancovali dve opice&ldquo;, zahrali sa na rozpr&aacute;vku &bdquo;Ťahal dedko repku&ldquo;, kde si mal&iacute; sil&aacute;ci zmerali sily so &scaron;a&scaron;om Maro&scaron;om. Pre s&uacute;ťažiace deti boli pripraven&eacute; sladk&eacute; odmeny. Na z&aacute;ver &scaron;a&scaron;o roztancoval v&scaron;etky deti na n&aacute;mest&iacute;. Zatancovali si deti aj dospel&aacute;ci. Rozžiaren&eacute; oči na&scaron;ich najmen&scaron;&iacute;ch boli odmenou pre v&scaron;etk&yacute;ch, čo sa z&uacute;častnili na realiz&aacute;cii detsk&eacute;ho predstavenia. Karlovesk&eacute; centrum kult&uacute;ry Tel. kontakt: 0903 780 032 Fotogal&eacute;ria tu","http://www.karlovaves.sk/novinka/predstavenie-sasa-marosa-roztancovalo-vsetky-deti-na-namesti","4.8.2011",,"3.8.2011","Karlova Ves","Správy"
"Poriadok musí byť !","Aj poriadok v uliciach Karlovej Vsi. Niekedy sa p&yacute;tame, prečo je to probl&eacute;m. Ulice, parky, chodn&iacute;ky, parkovisk&aacute;, dokonca detsk&eacute; ihrisk&aacute; ako keby k na&scaron;im domovom nepatrili. Doma by nikomu nenapadlo h&aacute;dzať smeti na zem. Ale verejn&eacute; priestranstvo je pre niektor&yacute;ch spoluobčanov miesto pre ich odpadky. A tak sa n&aacute;m hromadia na miestach, kde denne chodia ľudia, hraj&uacute; sa deti. O poriadok na uliciach v Karlovej Vsi sa staraj&uacute; pracovn&iacute;ci z refer&aacute;tu &uacute;držby a verejnoprospe&scaron;n&yacute;ch pr&aacute;c spolu s pracovn&iacute;kmi zaraden&yacute;mi do aktivačnej činnosti. Ved&uacute;ci oddelenia p. Brna vysiela svojich ľud&iacute; aj na z&aacute;klade podnetov od obyvateľov. Najnov&scaron;&iacute; bol podnet od obyvateľov zo Star&yacute;ch Gruntov, ktor&iacute; po odstr&aacute;nen&iacute; neporiadku vyjadrili svoju vďaku: &bdquo;P&aacute;n Brna zdrav&iacute;m, skl&aacute;dku ste pekne upratali...aj tie kamene s&uacute; super, aby sa tam aut&aacute; nedostali. Radosť pozerať a chodiť okolo !!!! Ďakujem pekne, aj za ostatn&yacute;ch obyvateľov rezidencie Grunty&ldquo;. V rubrike Poriadok mus&iacute; byť ! V&aacute;s budeme priebežne informovať o činnosti refer&aacute;tu v boji s neporiadkom na verejnom priestranstve v Karlovej Vsi, proste v&scaron;ade okolo n&aacute;s. N&aacute;prava neporiadku na parkovisku ul. Star&eacute; Grunty a pri plote cintor&iacute;na Sl&aacute;vičie &uacute;dolie. Fotogal&eacute;ria tu Vyčistenie les&iacute;ka Nad L&uacute;čkami &ndash; Beniakov&aacute; ul. Fotogal&eacute;ria tu ","http://www.karlovaves.sk/novinka/poriadok-musi-byt","1.8.2011",,,"Karlova Ves","Správy"
"&quot;O statočnom indiánovi&quot; - bábkové divadlo ŽUŽU"," &bdquo;Kamar&aacute;ti, m&aacute;te radi hviezdy? Hviezdy v sebe ukr&yacute;vaj&uacute; veľa rozpr&aacute;vok a pr&iacute;behov.&ldquo; Tak sa prihovorili b&aacute;bkoherci z divadielka ŽUŽU na&scaron;im najmen&scaron;&iacute;m v stredu 27. j&uacute;la 2011 na b&aacute;bkovom predstaven&iacute; &bdquo;O statočnom indi&aacute;novi&ldquo;. Ten na svojej rozpr&aacute;vkovej ceste spoznal nielen svojho najlep&scaron;ieho priateľa &Scaron;korpi&oacute;na, ale aj r&ocirc;zne typy postavičiek: samot&aacute;ra Kozorožca, veľk&eacute;ho ,,p&aacute;rtymana"" Barana, veľmi smutn&uacute; Rybu, Račaciu rodinku, z&uacute;riv&eacute;ho B&yacute;ka, lovcov Bl&iacute;žencov, lietaj&uacute;ceho Leva, pot&aacute;pača Vodn&aacute;ra ... Každ&eacute;mu sa snaž&iacute;l pom&ocirc;cť a každ&yacute; ho na opl&aacute;tku posunul bliž&scaron;ie ku z&aacute;zračnej Panne... Deti sa smiali, tajil sa im dych. Rozpr&aacute;vočka bola p&uacute;tav&aacute; a herci boli veľmi presvedčiv&iacute;. Hralo sa v obradnej sieni Miestneho &uacute;radu na N&aacute;m. sv. Franti&scaron;ka, keďže počasie sa nevedelo rozhodn&uacute;ť, či bude pr&scaron;ať alebo nie. Poz&yacute;vame v&scaron;etky deti 3. augusta 2011 na ďal&scaron;iu stredu pre najmen&scaron;&iacute;ch: na N&aacute;m. sv. Franti&scaron;ka, kde ich priv&iacute;ta &Scaron;A&Scaron;O MARO&Scaron; so svojou SHOW. Te&scaron;&iacute; sa na V&aacute;s starostka a ref. kult&uacute;ry Fotogal&eacute;ria tu","http://www.karlovaves.sk/novinka/o-statocnom-indianovi-babkove-divadlo-zuzu","27.7.2011",,"3.8.2011","Karlova Ves","Správy"
"Miestna knižnica pozýva čitateľov na novinky v knižnom svete","Je čas dovoleniek a to je pr&iacute;ležitosť preč&iacute;tať si p&aacute;r dobr&yacute;ch, zauj&iacute;mav&yacute;ch kn&iacute;h. Pre na&scaron;ich čitateľov sme pripravili na leto nov&eacute; knihy so zauj&iacute;mav&yacute;mi pr&iacute;behmi pln&eacute; nap&auml;tia. Detekt&iacute;vky, rom&aacute;ny, dobrodružn&eacute; knihy od slovensk&yacute;ch aj zahraničn&yacute;ch autorov. Čak&aacute;me V&aacute;s v knižnici a nezabudnite si čitateľsk&yacute; preukaz. Refer&aacute;t Miestnej knižnice PR&Iacute;RASTKY NOV&Yacute;CH KN&Iacute;H V KNIŽNICI: LITERAT&Uacute;RA PRE DOSPEL&Yacute;CH CONNELLY, Michael Rozsudok ulice Advok&aacute;t Heller mus&iacute; presvedčiť detekt&iacute;va Bosha o svojej nevine a z&aacute;roveň sa ubr&aacute;niť pred vrahom svojho kolegu. CRICHTON, MICAEL Pir&aacute;tska odysea Dobrodružn&yacute; rom&aacute;n o poklade a zrade, ktor&yacute; sa odohr&aacute;va v Karibiku v roku 1665. KOONTZ, Dean Z&aacute;blesk Strhuj&uacute;ci boj o existencii ľudstva. Kniha je kombin&aacute;ciou thrileru, hororu a sci - fi . KELLERMAN, Jonathan Moje druh&eacute; j&aacute; Op&auml;tovn&eacute; stretnutie psychol&oacute;ga Alexa a kontroverznej sexuologičky Sharon ... &Scaron;IKULOV&Aacute;, Veronika Miesto v sieti Autobiograficky motivovan&yacute; rom&aacute;n sa s&uacute;streďuje na osudy troch žien z jednej rodiny... D&Aacute;N , Dominik Studňa Detekt&iacute;vi rie&scaron;ia pr&iacute;pad brut&aacute;lne zavraždenej dvojice milencov. BASHIROV&Aacute;, Halina Slzy p&uacute;&scaron;te Dr&aacute;ma lek&aacute;rky, ktor&aacute; prežila peklo v Sud&aacute;ne. CODDINGTON, Andrea Židovka P&uacute;ť ženy plnej zr&aacute;d, bolest&iacute; a odriekavania. GRUENOV&Aacute;, Sara Voda pre slony. Strhuj&uacute;ci pr&iacute;beh zaujme historick&yacute;m pozad&iacute;m, hlbokou ľudskosťou, leskom, biedou a &scaron;pinou cirkusu na pozad&iacute; hospod&aacute;rskej kr&iacute;zy v tridsiatych rokoch USA LITERAT&Uacute;RA PRE DETI ARNOLD, Nick Nechutn&eacute; tr&aacute;venie Zauj&iacute;mav&yacute;m sp&ocirc;sobom podan&yacute; pr&iacute;beh z vn&uacute;tra tr&aacute;viaceho syst&eacute;mu. POSKITT, Kjartan Vrtkav&eacute; &scaron;ťastie. Tajomstv&aacute; pravdepodobnosti Ak m&aacute;te pocit, že sa v&aacute;m st&aacute;le lep&iacute; smola na p&auml;ty, tak potom pr&aacute;ve v&aacute;m je t&aacute;to kniha určen&aacute;. HARDCASTLE, Henry Ako sa stať objaviteľom. Pr&iacute;ručka dobrodruha. Klub odv&aacute;žnych cestovateľov poz&yacute;va smel&yacute;ch chlapcov a dievčat&aacute; na cestu za dobrodružstvom. BLYTONOV&Aacute;, Enid Hrmiaci vrch. &Scaron;tvorica priateľov a ich vern&yacute; hovoriaci papag&aacute;j Kiki sa vyber&uacute; na pr&aacute;zdniny do walesk&yacute;ch h&ocirc;r na osamoten&uacute; farmu. Link: http://www.karlovaves.sk/kniznica ","http://www.karlovaves.sk/novinka/miestna-kniznica-pozyva-citatelov-na-novinky-v-kniznom-svete","25.7.2011","21.7.2011","23.9.2011","Karlova Ves","Správy"
